{
  "schema_version": 1,
  "knowledge_id": "first-turn-knowledge-054cb22a4503437b50911247e375f26247d80b718e7ea8e3826e294947a7c7b6",
  "source_id": "tournament-source-d458804dce80c01fc27f5863c0b0ec821624627a61c0fd982dded04f41bc6aff",
  "asset_group_id": "asset-group-228cca96b5cf16a5e8d8f397cb30db073b483e75ddb0536d7d5f6f28783af340",
  "coverage_id": "coverage-0740b5b8fc8ec19df3e2abce23faeebf7b3199dae68b3160bc08a560c8f69b27",
  "suite_sha256": "6529f8921e3a4354cafa11391c2d9195ab699bb177ffd2e9e58d3009063dff38",
  "cases": [
    {
      "case_id": "soleret-empty-positive",
      "case_sha256": "e80258dec43b5b16c15c4682e14877fd3894bbe6a68ee01aebefa8234e329015",
      "journal_id": "e280d693496161e7f3fd447a491a435fa771e07d22c9292c4db79782aed86135",
      "rule_id": "83566725:empty_field_special",
      "kind": "procedure",
      "passed": true,
      "error": null,
      "runtime_request": {
        "protocol_version": 6,
        "engine": {
          "worker_path": "crates/ygo-knowledge/../../target/debug/ygo-engine-worker.exe",
          "ocgcore_path": "data/runtime/tournament-2026/frozen/engine/ocgcore.dll",
          "catalog_path": "data/runtime/tournament-2026/frozen/cards.cdb",
          "scripts_path": "data/runtime/tournament-2026/frozen/script",
          "script_manifest_path": "data/runtime/tournament-2026/frozen/scripts.json",
          "engine_manifest_path": "data/runtime/tournament-2026/frozen/engine/manifest.json",
          "timeout_ms": 30000
        },
        "deck": {
          "main": [
            83566725,
            83566725,
            83566725,
            25538345,
            25538345,
            25538345,
            46072770,
            46072770,
            46072770,
            90432163,
            36426778,
            36426778,
            36426778,
            63821877,
            88544390,
            52159691,
            99745551,
            99745551,
            65192027,
            44088353,
            32807846,
            81439173,
            62104532,
            88504133,
            24299458,
            24299458,
            85257384,
            98431356,
            25542642,
            25542642,
            14558127,
            14558127,
            23434538,
            42141493,
            42141493,
            42141493,
            94145021,
            10045474,
            10045474,
            40366667,
            40366667
          ],
          "extra": [
            26692769,
            65741786,
            58699500,
            29301450,
            4993187,
            62709239,
            62709239,
            28781003,
            91279700,
            77675029,
            1621413,
            16195942,
            64276752,
            90091224,
            78449284
          ],
          "side": []
        },
        "opening_hand": [
          83566725,
          46072770,
          25538345,
          44088353,
          99745551
        ],
        "seed": 1,
        "decisions": [
          {
            "prompt_id": 8,
            "player": 0,
            "choice": {
              "kind": "command",
              "command": 1,
              "index": 0
            }
          },
          {
            "prompt_id": 10,
            "player": 0,
            "choice": {
              "kind": "place",
              "zones": [
                {
                  "player": 0,
                  "location": 4,
                  "sequence": 0
                }
              ]
            }
          },
          {
            "prompt_id": 11,
            "player": 0,
            "choice": {
              "kind": "position",
              "position": 1
            }
          },
          {
            "prompt_id": 14,
            "player": 0,
            "choice": {
              "kind": "chain",
              "index": null
            }
          },
          {
            "prompt_id": 15,
            "player": 1,
            "choice": {
              "kind": "chain",
              "index": null
            }
          }
        ],
        "versions": {
          "rules": "ocg-mr5",
          "catalog": "catalog-de71e6b4683795a9cb83c44ba85bf1cc43d635ce8da032fff9f8b055b60e31b9",
          "banlist": "banlist-c98f770b366fed87be0fb23357a63d704db58b31508fbb88133fda66575f3783",
          "engine_sha256": "446f26df7a2fb35d94374d74f5f5a5ef200d5454322d372b325e46b4e083d7a9",
          "cdb_sha256": "3530f406ba92b0f8d5699aa107e95158a1f1b4816f8f5ca2dd82c490301ef632",
          "scripts_sha256": "26c44946c7aba56900ededc5358e163fce71d5b99182f0d0fa910739bc3d9c94",
          "core_commit": "38d04c9feb1a26617407091380634c87262fe3f8",
          "initializer": "fixed-ash-first-turn-v1"
        },
        "probe_only": false,
        "interruption": {
          "opponent_deck": {
            "main": [
              89631139,
              89631139,
              89631139,
              46986414,
              46986414,
              46986414,
              74677422,
              74677422,
              74677422,
              43096270,
              43096270,
              43096270,
              97590747,
              97590747,
              97590747,
              69247929,
              69247929,
              69247929,
              15025844,
              15025844,
              15025844,
              13039848,
              13039848,
              13039848,
              91152256,
              91152256,
              91152256,
              76184692,
              76184692,
              76184692,
              32452818,
              32452818,
              32452818,
              70781052,
              70781052,
              70781052,
              48531733,
              48531733,
              48531733,
              14558127
            ],
            "extra": [],
            "side": []
          },
          "opponent_hand": [
            14558127
          ],
          "policy": "pass",
          "effect_id": "25538345:discard_and_mill",
          "occurrence": 1
        },
        "first_turn": {
          "asset_group_id": "asset-group-228cca96b5cf16a5e8d8f397cb30db073b483e75ddb0536d7d5f6f28783af340",
          "source_id": "tournament-source-d458804dce80c01fc27f5863c0b0ec821624627a61c0fd982dded04f41bc6aff",
          "coverage_id": "coverage-0740b5b8fc8ec19df3e2abce23faeebf7b3199dae68b3160bc08a560c8f69b27",
          "knowledge_id": "first-turn-knowledge-054cb22a4503437b50911247e375f26247d80b718e7ea8e3826e294947a7c7b6",
          "ash_effects": [
            {
              "effect_id": "25538345:discard_and_mill",
              "card_id": 25538345,
              "description": 26778895646720,
              "source_locations": 4
            },
            {
              "effect_id": "46072770:monster_search",
              "card_id": 46072770,
              "description": 48310800875521,
              "source_locations": 4
            },
            {
              "effect_id": "90432163:grave_search",
              "card_id": 90432163,
              "description": 94824995749889,
              "source_locations": 16
            },
            {
              "effect_id": "36426778:grave_spell_trap_search",
              "card_id": 36426778,
              "description": 38196245168129,
              "source_locations": 16
            },
            {
              "effect_id": "63821877:grave_mill",
              "card_id": 63821877,
              "description": 66922088497152,
              "source_locations": 16
            },
            {
              "effect_id": "99745551:random_discard_special_draw",
              "card_id": 99745551,
              "description": 104590790885376,
              "source_locations": 2
            },
            {
              "effect_id": "44088353:self_field_destroy_draw",
              "card_id": 44088353,
              "description": 46229988835328,
              "source_locations": 10
            },
            {
              "effect_id": "32807846:warrior_search",
              "card_id": 32807846,
              "description": 0,
              "source_locations": 10
            },
            {
              "effect_id": "81439173:monster_mill",
              "card_id": 81439173,
              "description": 85395162267648,
              "source_locations": 10
            },
            {
              "effect_id": "23434538:draw_observer",
              "card_id": 23434538,
              "description": 24572894117888,
              "source_locations": 2
            },
            {
              "effect_id": "42141493:empty_field_draw_observer",
              "card_id": 42141493,
              "description": 44188558163968,
              "source_locations": 2
            },
            {
              "effect_id": "26692769:deck_mill_and_set",
              "card_id": 26692769,
              "description": 27989396946944,
              "source_locations": 4
            },
            {
              "effect_id": "78449284:deck_special",
              "card_id": 78449284,
              "description": 82260036419584,
              "source_locations": 4
            },
            {
              "effect_id": "78449284:xyz_dragon_rank_up_search",
              "card_id": 78449284,
              "description": 82260036419585,
              "source_locations": 4
            }
          ]
        }
      },
      "before_call": 1,
      "after_call": 2,
      "replay_calls": [
        3,
        4
      ],
      "resolution_events": [],
      "binding": {
        "kind": "procedure",
        "source": {
          "code": 83566725,
          "player": 0,
          "location": 2,
          "sequence": 2,
          "position": 0
        },
        "expected_description": null,
        "prompt_description": null
      },
      "ledger": {
        "consumed": 4,
        "reserved": 0,
        "completed": 4,
        "unknown": 0,
        "abandoned": 0,
        "limit": 512
      },